[
  {
    "id": "NOTIF-006",
    "module": "notifications",
    "title": "markAllRead missing; `isRead` vs `read` field mismatch inflates unread count",
    "severity": "Medium",
    "status": "fixed",
    "statusRaw": "🟢 FIXED",
    "category": "UX",
    "firstDetected": "Pre-seed",
    "lastVerified": "2026-06-20",
    "runsOpen": 0,
    "fixEvidence": "`NotificationContext.js`: fetchNotifications normalises `isRead→read`; markAsRead sets both fields; `markAllRead` function added",
    "sourceFile": "QA_Tracker/NOTIFICATIONS_QA_LIVE_TRACKER.md"
  },
  {
    "id": "NOTIF-007",
    "module": "notifications",
    "title": "unreadCount race window — two sequential queries between list and count",
    "severity": "Medium",
    "status": "fixed",
    "statusRaw": "🟢 FIXED",
    "category": "Data",
    "firstDetected": "Pre-seed",
    "lastVerified": "2026-06-20",
    "runsOpen": 0,
    "fixEvidence": "`notification.service.js` already uses `Promise.all` for both queries — pre-seed diagnosis was incorrect",
    "sourceFile": "QA_Tracker/NOTIFICATIONS_QA_LIVE_TRACKER.md"
  },
  {
    "id": "NOTIF-008",
    "module": "notifications",
    "title": "Scan ID fuzzy match: `baseScanId.startsWith(k)` can wrongly match shorter scan IDs",
    "severity": "Medium",
    "status": "fixed",
    "statusRaw": "🟢 FIXED",
    "category": "Delivery",
    "firstDetected": "Pre-seed",
    "lastVerified": "2026-06-20",
    "runsOpen": 0,
    "fixEvidence": "`NotificationContext.js`: removed `|| baseScanId.startsWith(k)` from scan-cancelled handler",
    "sourceFile": "QA_Tracker/NOTIFICATIONS_QA_LIVE_TRACKER.md"
  },
  {
    "id": "NOTIF-012",
    "module": "notifications",
    "title": "NotificationMenu renders `notification.title` — field absent in Notification model — title label always blank",
    "severity": "Medium",
    "status": "fixed",
    "statusRaw": "🟢 FIXED",
    "category": "UX",
    "description": "**File:** `vibrantix-client-panel/src/components/notifications/NotificationMenu.js` (and `NotificationMenu_chakra.js`)\n**Line:** 118\n**Root Cause:** `{notification.title}` is rendered in the header row, but the Notification MongoDB schema and `dispatch()` payload have no `title` field. The human-readable content is in `message`.\n**Impact:** The bold colored label at the top of each notification item is always empty — the notification looks broken with no identifying header text.\n**Fix:** Replace `notification.title` with a formatted `notificationType` label (e.g., `'task_assigned'` → `'Task Assigned'`). Also align `getNotificationColor` call to use `notification.notificationType` (see NOTIF-013).",
    "firstDetected": "Run 2",
    "lastVerified": "2026-06-20",
    "runsOpen": 0,
    "fixEvidence": "Both menu files: `{notification.title}` → `{formatType(notification.notificationType)}` with helper that formats snake_case to Title Case",
    "sourceFile": "QA_Tracker/NOTIFICATIONS_QA_LIVE_TRACKER.md"
  },
  {
    "id": "NOTIF-015",
    "module": "notifications",
    "title": "`notificationService.js` preference methods call non-existent backend endpoints (`/notifications/events`, `/notifications/preferences/*`) — all 404",
    "severity": "Medium",
    "status": "fixed",
    "statusRaw": "🟢 FIXED",
    "category": "Data",
    "description": "**File:** `vibrantix-client-panel/src/services/notificationService.js`\n**Root Cause:** `getNotificationEvents()`, `getEventsByCategory()`, `getProjectPreferences()`, `upsertProjectPreferences()`, `upsertNotificationRule()`, `deleteNotificationRule()`, `updateGlobalSettings()`, `getOrganizationUsers()` call endpoints that do not exist in `vibrantix-backend/src/modules/notification/notification.routes.js`. The actual routes are limited to `/unread-count`, `/client`, `/mark-all-read`, `/:id/read`, `/:id`.\n**Impact:** Any component using these preference methods gets a 404 error. Notification preference settings pages cannot load or save preferences.\n**Fix:** Either implement the missing backend routes (`GET /events`, `GET /preferences/:projectId`, `PUT /preferences/:projectId`, etc.) or clearly stub these methods as unimplemented. The inbox methods (`getMyNotifications`, `getUnreadCount`, `markAsRead`, `markAllAsRead`, `deleteNotification`) are correct.",
    "firstDetected": "Run 2",
    "lastVerified": "2026-06-20",
    "runsOpen": 0,
    "fixEvidence": "`notification.routes.js`: 7 stub routes added for `/events`, `/events/:category`, `/preferences/:projectId` (GET/PUT), `/preferences/:projectId/rules` (POST/DELETE), `/preferences/:projectId/global-settings` (PATCH)",
    "sourceFile": "QA_Tracker/NOTIFICATIONS_QA_LIVE_TRACKER.md"
  }
]
