[
  {
    "id": "NOTIF-001",
    "module": "notifications",
    "title": "Notification fetch in NotificationContext was a complete no-op",
    "severity": "High",
    "status": "fixed",
    "statusRaw": "🟢 FIXED",
    "category": "Delivery",
    "firstDetected": "Pre-seed",
    "lastVerified": "2026-06-20",
    "runsOpen": 0,
    "fixEvidence": "`NotificationContext.js`: active `GET /notifications/client?limit=50` call on connect",
    "sourceFile": "QA_Tracker/NOTIFICATIONS_QA_LIVE_TRACKER.md"
  },
  {
    "id": "NOTIF-002",
    "module": "notifications",
    "title": "dispatch() doesn't check queue.add() return — silent drop when Redis is down",
    "severity": "High",
    "status": "fixed",
    "statusRaw": "🟢 FIXED",
    "category": "Delivery",
    "firstDetected": "Pre-seed",
    "lastVerified": "2026-06-20",
    "runsOpen": 0,
    "fixEvidence": "`notification.service.js`: try/catch around queue.add + fallback direct Socket.IO emit",
    "sourceFile": "QA_Tracker/NOTIFICATIONS_QA_LIVE_TRACKER.md"
  },
  {
    "id": "NOTIF-003",
    "module": "notifications",
    "title": "Internal endpoint fails closed (503) when token unset — inconsistent with other internal routes",
    "severity": "High",
    "status": "fixed",
    "statusRaw": "🟢 FIXED",
    "category": "Enterprise",
    "firstDetected": "Pre-seed",
    "lastVerified": "2026-06-20",
    "runsOpen": 0,
    "fixEvidence": "`notification-internal.routes.js`: fail-open pattern (`if (!INTERNAL_TOKEN) return next()`)",
    "sourceFile": "QA_Tracker/NOTIFICATIONS_QA_LIVE_TRACKER.md"
  },
  {
    "id": "NOTIF-004",
    "module": "notifications",
    "title": "Socket.IO static token — Keycloak expiry kills real-time notifications without page reload",
    "severity": "High",
    "status": "fixed",
    "statusRaw": "🟢 FIXED",
    "category": "Enterprise",
    "firstDetected": "Pre-seed",
    "lastVerified": "2026-06-20",
    "runsOpen": 0,
    "fixEvidence": "`NotificationContext.js`: token-watch useEffect updates `socket.auth` and reconnects; removed force-disconnect on jwt error",
    "sourceFile": "QA_Tracker/NOTIFICATIONS_QA_LIVE_TRACKER.md"
  },
  {
    "id": "NOTIF-005",
    "module": "notifications",
    "title": "Socket.IO room `user:{id}` — cross-org notification leakage for multi-org users",
    "severity": "High",
    "status": "fixed",
    "statusRaw": "🟢 FIXED",
    "category": "Enterprise",
    "firstDetected": "Pre-seed",
    "lastVerified": "2026-06-20",
    "runsOpen": 0,
    "fixEvidence": "`socket.js`: join `org:{orgId}:user:{userId}` room; `notification.worker.js` + `notification.service.js`: emit to org-scoped room",
    "sourceFile": "QA_Tracker/NOTIFICATIONS_QA_LIVE_TRACKER.md"
  },
  {
    "id": "NOTIF-011",
    "module": "notifications",
    "title": "NotificationMenu click-to-navigate uses `notification.link` but dispatch field is `navigateTo` — zero clicks navigate",
    "severity": "High",
    "status": "fixed",
    "statusRaw": "🟢 FIXED",
    "category": "Delivery",
    "description": "**File:** `vibrantix-client-panel/src/components/notifications/NotificationMenu.js` (and `NotificationMenu_chakra.js`)\n**Line:** 33\n**Root Cause:** `handleNotificationClick` checks `notification.link` for navigation, but `dispatch()` populates `navigateTo`, not `link`. The field `link` is never set by the backend or socket emit.\n**Impact:** Every notification click never navigates. The `markAsRead` fires correctly but the navigation step is silently skipped.\n**Fix:** Replace `notification.link` with `notification.navigateTo` in both menu components.",
    "firstDetected": "Run 2",
    "lastVerified": "2026-06-20",
    "runsOpen": 0,
    "fixEvidence": "Both `NotificationMenu.js` and `NotificationMenu_chakra.js`: `notification.link` → `notification.navigateTo`",
    "sourceFile": "QA_Tracker/NOTIFICATIONS_QA_LIVE_TRACKER.md"
  }
]
