[
  {
    "id": "TV-030",
    "module": "trust-vault",
    "title": "Version history has no date-range filter or search — flat accordion list; certifications with many versions require scrolling through all recent entries; violates ISO 27001:2022 Clause 7.5",
    "severity": "Low",
    "status": "wont_fix",
    "statusRaw": "VersionHistory.jsx is dead code — never imported or rendered anywhere in the app (confirmed while working TV-023, which targets the same file). No live screen exists to add a date-range filter to, so this is won't-fix until/unless the component is wired up for real.",
    "category": "UX",
    "description": "Files: vibrantix-client-panel/src/components/trust-vault/VersionHistory.jsx\n\nRoot Cause: Flat accordion list with no filtering or search. Certifications with many versions require scrolling through all entries to find a specific date range.\n\nClaude Fix Prompt: Add `<DateRangePicker value={dateRange} onChange={setDateRange} />` above the version list. Filter displayed versions: `const filteredVersions = dateRange ? versions.filter(v => isWithinInterval(new Date(v.createdAt), dateRange)) : versions;`. Add search by `changedBy` name: `<Input placeholder=\"Search by reviewer...\" value={search} onChange={e => setSearch(e.target.value)} />`.",
    "firstDetected": "2026-05-20",
    "lastVerified": "2026-06-12",
    "runsOpen": 1,
    "requirement": "ISO 27001:2022 Clause 7.5",
    "sourceFile": "QA_Tracker/TRUST_VAULT_QA_LIVE_TRACKER.md"
  },
  {
    "id": "TV-031",
    "module": "trust-vault",
    "title": "`customLabel` field has no length validation — `TrustNetworkSharingPanel` Input has no `maxLength` attribute; excessively long labels overflow partner-facing views",
    "severity": "Low",
    "status": "fixed",
    "statusRaw": "Already fixed in the live code — the customLabel Input in TrustNetworkSharingPanel.jsx already has maxLength={100}, a live 'X/100' counter, and a >100-char rejection check in handleSave. No code change was needed; verified by reading the current file.",
    "category": "Data Validation",
    "description": "Files: vibrantix-client-panel/src/components/trust-vault/TrustNetworkSharingPanel.jsx\n\nRoot Cause: `customLabel` Input has no `maxLength` attribute and no Yup validation. Excessively long labels overflow partner-facing shared views.\n\nClaude Fix Prompt: Add `maxLength={80}` to the Input. Add Yup validation: `customLabel: Yup.string().max(80, 'Custom label must be 80 characters or fewer').optional()`. Add character counter: `<span className=\"text-xs text-muted-foreground\">{customLabel.length}/80</span>`.",
    "firstDetected": "2026-05-20",
    "lastVerified": "2026-06-12",
    "runsOpen": 1,
    "sourceFile": "QA_Tracker/TRUST_VAULT_QA_LIVE_TRACKER.md"
  },
  {
    "id": "TV-032",
    "module": "trust-vault",
    "title": "`visibleToPartners` count not clickable in `VaultHealthWidget` — \"Visible to N partners\" rendered as plain text; no navigation shortcut to Trust Network settings or partner list; violates Annex A 5.14",
    "severity": "Low",
    "status": "open",
    "statusRaw": "🔴 OPEN",
    "category": "UX",
    "description": "Files: vibrantix-client-panel/src/components/trust-vault/VaultHealthWidget.jsx\n\nRoot Cause: \"Visible to N partners\" rendered as plain text with no link or navigation shortcut to Trust Network settings or the partner list.\n\nClaude Fix Prompt: Wrap in `<Link href=\"/trust-vault/settings/trust-network\">`: `<Link href=\"/trust-vault/settings/trust-network\" className=\"text-sm text-primary hover:underline flex items-center gap-1\"><Users className=\"w-4 h-4\" />Visible to {visibleToPartners} partners<ChevronRight className=\"w-3 h-3\" /></Link>`.",
    "firstDetected": "2026-05-20",
    "lastVerified": "2026-06-12",
    "runsOpen": 1,
    "requirement": "Annex A 5.14",
    "sourceFile": "QA_Tracker/TRUST_VAULT_QA_LIVE_TRACKER.md"
  },
  {
    "id": "TV-033",
    "module": "trust-vault",
    "title": "`publicSummary` Textarea has no character counter or maximum length enforcement — `IncidentForm` shows placeholder text only; no `maxLength`; no minimum content warning when `trustNetworkEnabled` is false; single-character entry valid; violates Annex A 5.26",
    "severity": "Low",
    "status": "in_progress",
    "statusRaw": "Fixed — added maxLength={500} to the Textarea (IncidentForm.jsx) and made the character counter always visible: shows X/50 progress toward the sharing minimum when Trust Network sharing is on, X/500 toward the cap otherwise. Pending verification in the running app.",
    "category": "Data Validation",
    "description": "Files: vibrantix-client-panel/src/components/trust-vault/IncidentForm.jsx\n\nRoot Cause: `publicSummary` Textarea shows placeholder text only. No `maxLength`, no character counter, no minimum content warning when `trustNetworkEnabled` is active.\n\nClaude Fix Prompt: Add `maxLength={500}` to Textarea. Display counter: `<span className=\"text-xs text-muted-foreground\">{publicSummary.length}/500</span>`. When `trustNetworkEnabled`: `{publicSummary.length < 50 && <p className=\"text-xs text-destructive\">Minimum 50 characters required when sharing with partners ({50 - publicSummary.length} more needed)</p>}`.",
    "firstDetected": "2026-05-20",
    "lastVerified": "2026-06-12",
    "runsOpen": 1,
    "requirement": "Annex A 5.26",
    "sourceFile": "QA_Tracker/TRUST_VAULT_QA_LIVE_TRACKER.md"
  }
]
