[
  {
    "id": "SEC-037",
    "module": "security-vulnerability",
    "title": "Dormant ClientAuthContext stores JWT + refresh token in localStorage (unreachable dead code)",
    "status": "new",
    "statusRaw": "NEW",
    "severity": "Low",
    "tags": [
      "CWE-522",
      "A02:2021 Cryptographic Failures"
    ],
    "component": "src/contexts/ClientAuthContext.js",
    "firstDetected": "2026-07-18",
    "lastVerified": "2026-07-18",
    "sourceFile": "QA_Tracker/SECURITY_VULNERABILITY_QA_LIVE_TRACKER.md"
  },
  {
    "id": "SEC-040",
    "module": "security-vulnerability",
    "title": "Unused `nginx` npm package declared as a runtime dependency, zero imports found",
    "status": "new",
    "statusRaw": "NEW",
    "severity": "Low",
    "tags": [
      "CWE-1104",
      "A06:2021 Vulnerable and Outdated Components"
    ],
    "component": "package.json",
    "firstDetected": "2026-07-18",
    "lastVerified": "2026-07-18",
    "sourceFile": "QA_Tracker/SECURITY_VULNERABILITY_QA_LIVE_TRACKER.md"
  },
  {
    "id": "SEC-041",
    "module": "security-vulnerability",
    "title": "Deprecated, unused `react-beautiful-dnd` dependency still declared",
    "status": "new",
    "statusRaw": "NEW",
    "severity": "Low",
    "tags": [
      "CWE-1104",
      "A06:2021 Vulnerable and Outdated Components"
    ],
    "component": "package.json",
    "firstDetected": "2026-07-18",
    "lastVerified": "2026-07-18",
    "sourceFile": "QA_Tracker/SECURITY_VULNERABILITY_QA_LIVE_TRACKER.md"
  },
  {
    "id": "SEC-043",
    "module": "security-vulnerability",
    "title": "Mock/stub API routes leak a real-looking internal employee email and hardcoded org/project IDs",
    "status": "new",
    "statusRaw": "NEW",
    "severity": "Low",
    "tags": [
      "CWE-200",
      "A01:2021 Broken Access Control"
    ],
    "component": "api/client/audits-v2 stub routes",
    "firstDetected": "2026-07-18",
    "lastVerified": "2026-07-18",
    "sourceFile": "QA_Tracker/SECURITY_VULNERABILITY_QA_LIVE_TRACKER.md"
  },
  {
    "id": "SEC-044",
    "module": "security-vulnerability",
    "title": "Client-panel API route handlers have no in-handler auth check, rely entirely on edge middleware",
    "status": "new",
    "statusRaw": "NEW",
    "severity": "Low",
    "tags": [
      "CWE-284",
      "A01:2021 Broken Access Control"
    ],
    "component": "src/app/api/client/**, src/app/api/log",
    "firstDetected": "2026-07-18",
    "lastVerified": "2026-07-18",
    "sourceFile": "QA_Tracker/SECURITY_VULNERABILITY_QA_LIVE_TRACKER.md"
  },
  {
    "id": "SEC-046",
    "module": "security-vulnerability",
    "title": "Minor sensitive-data logging in error paths (`console.error` of full API response objects)",
    "status": "new",
    "statusRaw": "NEW",
    "severity": "Low",
    "tags": [
      "CWE-532",
      "A09:2021 Security Logging and Monitoring Failures"
    ],
    "component": "authSlice.js, Navbar.jsx",
    "firstDetected": "2026-07-18",
    "lastVerified": "2026-07-18",
    "sourceFile": "QA_Tracker/SECURITY_VULNERABILITY_QA_LIVE_TRACKER.md"
  }
]
